video_id,comments
jAhjPd4uNFY,"['You want to learn more about science? Check out our sciency products on the kurzgesagt shop – all designed with love and produced with care. \nGetting something from the kurzgesagt shop is the best way to support us and to keep our videos free for everyone. \n►► http://kgs.link/science\n(Worldwide Shipping Available)', 'This may go the same with nuclear stuff at first wow beautiful then stop nuclear weapons', ""I'm not exaggerating when I say this video changed the course of my life. I was 15 when this video was first released and I remember clearly how astonished and amazed I was at the concept of genetic engineering and this was the first video that introduced me to the concept of CRISPR.  I always had a strong passion and enthusiasm for science and biology, and after watching this specific video I did further research on CRISPR myself and decided it would be fascinating to pursue further. \n\nFast forward a few years and I had finished my undergraduate degree in Genetics, followed by a Masters, in which I specifically chose a research project including working with CRISPR. At the time of writing this comment I am 23 and currently a second year PhD student, with my project focusing primarily on generating tagged cell lines using CRISPR Knock-In technology to understand genetic disease phenotypes. I often come back to this video to re-watch how this journey started for me, and is it crazy to think that it began with watching this specific video, and how fortunate I am now to understand and work with CRISPR on a daily basis. \n\nI very rarely write YouTube comments, but considering this video literally changed my life, I think it is worthy of a message expressing my thanks and gratitude for this incredible video, and your even more incredible channel. The main point I want to make is that all the hard work this YouTube channel puts into making videos has not only entertained me for countless hours, but has more importantly been the starting point for my career in science, as I'm sure it has for thousands of your other subscribers. The content you make is beyond priceless, and I will never forget how important these videos have been in shaping my life for the better. So thank you, Kurzgesagt, I will forever be grateful :)"", ""What would stop an authoritarian regime from genetically engineering super-soldiers? That's an easy one! Because, uh, the genetically engineered super-soldiers might turn against the regime? Maybe?"", 'I love how this was this massive thing and now no one talks about, just coming out of 2023', ""Don't do it without civil engineering and car truck electronics electrical engineering approval because underground magnetic can resulr2 head babies dicked girls ect"", '0:07 immediately a DHMIS reference? This is my new favorite Youtube channel 🥹', 'My school had a word gen on this a few months ago I wish I found this sooner 😢', 'Someone should write a sci-fi about this😢😢', 'Disgusting who is altering their baby to “for their wants” 😒\nWhat kind of parent are you?!!']"
RLykC1VN7NY,"['You want to learn more about space? Check out our space products on the kurzgesagt shop – all designed with love and produced with care. \nGetting something from the kurzgesagt shop is the best way to support us and to keep our videos free for everyone.  \n►► http://kgs.link/space\n(Worldwide Shipping Available)', 'Grb be like: I’m 50 light years away from your current location and approaching rapidly', 'This is the weirdest cover of “imagine” I’ve heard', ""I'm starting to understand why people are so desperate to believe the earth is flat and motionless and that the universe revolves around US.... It makes this stuff a whole lot less scary"", '*PHONK*', 'A great point to end the video at!', 'Thats why you should be thankful for every second you ever have lived', 'When I said laser tag, this is not what I meant.', ""Long ago, on the planet Thalath, an advanced civilization thrived. Over time, their scientists developed technologies that allowed them to observe cosmic events in distant star systems.\n\n\r\nDuring one of these quantum explorations, the Thalathians discovered the star system of Arkan. However, among the leaders of Thalath, an ambitious ruler named Xarion felt an imagined threat as he observed the development of life on Arkan. His fears, born of unfounded paranoia, led him to make a devastating decision.\r\n\r\nIn an unprecedented act of hostility, Xarion ordered a powerful gamma-ray burst (GRB) to be unleashed, aiming to extinguish life on Arkan. However, this action would not materialize until thousands of years in the future when the GRB finally reached its destination.\r\n\r\nAs the Thalathians continued to observe the evolution of Arkan, they were fascinated by the richness of life and the complexity of its society. However, tragedy loomed over them, unbeknownst to the civilization on Arkan.\r\n\r\nIn Thalath, the knowledge of the inevitable fate of Arkan became a burden for those who were aware of Xarion's actions. While life on Arkan flourished, the shadow of the GRB loomed on the horizon.\r\n\r\nThroughout the millennia, the Thalathians wrestled with the responsibility of their own dark past. Society was divided between those seeking redemption for Xarion's mistakes and those preferring to ignore the grim legacy.\r\n\r\nFinally, when the GRB reached Arkan, the Thalathians witnessed the collapse of a civilization that could have continued to prosper if not for the impulsive decisions of its own leader.\r\n\r\nThe legacy of Arkan became a constant reminder of the dangers of unfounded paranoia and hostility. The Thalathians, confronted with their own history, embarked on a collective journey of introspection and change, seeking to build a future based on understanding, responsibility, and peaceful coexistence.\n\n(Written by ChatGPT on a plot presented by myself)"", 'Cool  \n\\/']"
dGiQaabX3_o,"['Head over to our shop to get exclusive kurzgesagt merch and sciency products designed with love. \nGetting something from the kurzgesagt shop is the best way to support us and to keep our videos free for everyone. \n►► http://kgs.link/shopkgs\n(Worldwide Shipping Available)', 'I don’t take anything for granted. I think of what would happen if it all went to hell.', '“Not worry about survival”', 'And yet we still fight and kill each other on a daily basis...', 'Nice starfox reference', 'Did nobody notice the pokemon at 8:14?', 'Everything here is wrong. Neanderthals mixed with homo sapiens to the point they disappeared.  Also Neanderthals are now considered same human as us. Look it up..we have been same people for over hundreds of thousands of years.', 'We’re still weeding each other out.', 'Am I the only one who noticed the Sailor Moon wand at 8:16?', 'Many thanks to all the scientist and engineers that brought us all we have today.']"
JQVmkDUkZT4,"['Head over to our shop to get exclusive kurzgesagt merch and sciency products designed with love. \nGetting something from the kurzgesagt shop is the best way to support us and to keep our videos free for everyone. \n►► http://kgs.link/shopkgs\n(Worldwide Shipping Available)', 'This video… is two', 'im an idiot sandwich', 'When they said that it takes about 7 years for your cells to be replaced, I looked down and saw this video was released 7 years ago. I am literally not the same person who watched this video when it released.', 'Who else came here from CGP grey', '2:04 RIP brothers 🫡', 'Realty ruins my life', 'No you’re an idiot sandwich', 'Does that mean we can all become shapeshifters if our cells agree on it?', 'Infinite loop...']"
ZL4yYHdDSWs,"['Hey Everybody! So this video has a mistake and we remade it!\xa0 You can watch the corrected and updated Version here: https://youtu.be/uzkD5SeuwzM\n\nWhat is the mistake? In a nutshell: It is not PHYSICALLY impossible to leave the Local Group as we said in this version. It is just extremely unlikely that we’ll ever do it, even for the standards of our videos.\nBUT: If you have a lot of time and a fast spaceship you can still fly to a limited amount of galaxies – these galaxies will eventually get out of reach forever but until then, they are within reach. Although every second some of them escape us forever.\n\nOk, if this is so why did we keep the video up and not purge it when we deleted our addiction and refugee crisis videos? Well, it has to do with the nature and severity of the mistake: This mistake was much more straight forward then with the other two videos, so we did talk to a few astrophysicists to ask them what they thought and if we should take down the video. Their feedback was pretty clear, they thought it was still fine as the universe expansion things explained in the video are correct and they didn’t consider the local group thing as too major. This was actually a case of “good enough”.\n\nAlso, back when this original upload happened, Kurzgesagt was operating at pretty tight margins and just redoing a video was not easy for us. Back then the team was small and we were fighting to put new videos out. So we just swallowed the bitter pill and kept the video around.\n\nBut the video still bothered us, as far as we know this was the biggest unfixed mistake on the channel. Super frustrating, especially because the core idea of the video is so fascinating. The limit of our species. The actual limit. So yeah, we finally remade the video, sorry for taking this long, life got in the way.\n\nThe original video will stay up, you can compare the two if you want to see how far we have come in a few years in terms of production quality. All in all, we could only grow the channel and work on getting better because of direct support from you guys. So thank you for that. – Philipp\n\nPS: If you want, check out our shop for some new posters about the universe posters and black hole plushies and stuff like that: kgs.link/shop\u200b', 'dont bite more than you can chew solar system is enough for now', '😜jk', 'I am from the future', 'Veritasium inspired', 'Who else saw this in SoLLMINATI reacts playlist\n👇🏿', 'What Do You Think About the Evolution of Humans and How Far Can Humanity Go?\n\nThe evolutionary process we undergo is in order to adapt us to the upper world, i.e., to lead us to a state of harmonious connection “as one man with one heart,” one humanity functioning as a single system.\n\nWe exist in an integral system with interconnection and interdependence among its parts.\n\nIn the process, we need to experience that we are enslaved to our egoistic human nature, which makes us want to enjoy at the expense of others and nature, to a state of freedom from this egoistic servitude.\n\nWhat is that place of freedom?\n\nIt is a place where we discover integrality, a deep connection from one end of nature to the other, which emerges from the upper force’s desire to love and to bestow.\n\nThe upper force of love and bestowal guides and relates to us as a single entity, and leads us to a stage where it will grant us mutual connection, where we will each primarily consider the benefit of others and the whole system we exist in.\n\nIn other words, from living in servitude to our egoistic desires, which we are currently locked in, we develop through various crises on personal, social and global scales, through which we gradually obtain the possibility of exiting the egoistic network that controls us, and entering into a new altruistic network of connections.\n\nWhy do we need to endure various crises in order to exit our egos?\n\nIt is because the human ego is very cruel, and we are incapable of rising above it with our own strength. That is, we lack the ability to convince ourselves that it is worthwhile to be positive, kind and loving of one another all over the planet. It is simply impossible while our egoistic nature constantly pulls us in an opposite direction—to self-benefit at the expense of others and nature.\n\nTherefore, in order to show us how our egoistic attitudes make us suffer, nature sends us various crises that oblige us to face our connection, and the need to realize it positively. Accordingly, we then come to see that we have no choice but to correct our attitudes to each other, from egoistic to altruistic.', 'What Do You Think About the Evolution of Humans and How Far Can Humanity Go?\n\nThe evolutionary process we undergo is in order to adapt us to the upper world, i.e., to lead us to a state of harmonious connection “as one man with one heart,” one humanity functioning as a single system.\n\nWe exist in an integral system with interconnection and interdependence among its parts.\n\nIn the process, we need to experience that we are enslaved to our egoistic human nature, which makes us want to enjoy at the expense of others and nature, to a state of freedom from this egoistic servitude.\n\nWhat is that place of freedom?\n\nIt is a place where we discover integrality, a deep connection from one end of nature to the other, which emerges from the upper force’s desire to love and to bestow.\n\nThe upper force of love and bestowal guides and relates to us as a single entity, and leads us to a stage where it will grant us mutual connection, where we will each primarily consider the benefit of others and the whole system we exist in.\n\nIn other words, from living in servitude to our egoistic desires, which we are currently locked in, we develop through various crises on personal, social and global scales, through which we gradually obtain the possibility of exiting the egoistic network that controls us, and entering into a new altruistic network of connections.\n\nWhy do we need to endure various crises in order to exit our egos?\n\nIt is because the human ego is very cruel, and we are incapable of rising above it with our own strength. That is, we lack the ability to convince ourselves that it is worthwhile to be positive, kind and loving of one another all over the planet. It is simply impossible while our egoistic nature constantly pulls us in an opposite direction—to self-benefit at the expense of others and nature.\n\nTherefore, in order to show us how our egoistic attitudes make us suffer, nature sends us various crises that oblige us to face our connection, and the need to realize it positively. Accordingly, we then come to see that we have no choice but to correct our attitudes to each other, from egoistic to altruistic.', 'It’s all absurd what a joke the existence of human race', 'What if someone would say i ll be dead hunders of years by the time we can send robots to the next solar system. So, i dont really care.']"
V9_PjdU3Mpo,"['You want to learn more about science? Check out our sciency products on the kurzgesagt shop – all designed with love and produced with care. \nGetting something from the kurzgesagt shop is the best way to support us and to keep our videos free for everyone. \n►► http://kgs.link/science\n(Worldwide Shipping Available)', 'The art deco style on this one is so perfect. ""Metropolis"" feelings and dystopian vibes makes a great mix for the illustration details and color', 'Apple really hypocrite, they reject fbi proposal but somehow they approve chinese proposal to set backdoor on their devices.', ""We've interrupted evolution.\nThings will happen."", 'Government:Lets use more invasive methods that aren’t effective\nEveryone:wait that’s not how it wor…\nGovernment: Do you want to disappear', '“Right now, we live in a democracy” if only they knew 😪', 'For me every major goverment and it\'s inteligence agency has our privacy ""deep up their rectum""', ""Wait, you're telling me that not only can the government know exactly what I'm doing and when on my devices, but that they also can know what content I consume, some of which may be questionable for.. *certain* reasons? Well, crap. Guess incognito didn't work then."", 'So you are making videos so they can select whom they are watching fa apping', 'Government: NOO LETS GO MURDER EVERYONE BC OF TERRORISTSSSSS\nCommon Sense: Do I look like a joke to you?']"
qPQQwqGWktE,"['You want to learn more about space? Check out our space products on the kurzgesagt shop – all designed with love and produced with care. \nGetting something from the kurzgesagt shop is the best way to support us and to keep our videos free for everyone.  \n►► http://kgs.link/space\n(Worldwide Shipping Available)', 'my friend the tether would get distoryed by gravity imagine the weight of the long tether', '1:23 We are ants trying to enter space', 'Wouldnt satellites bump into it all the time ?', 'I honestly don’t think this will ever happen due to how terrifying it would be if the counterweight snapped off and a giant Diamond nanothread whip slammed into like four continents at once. That’s just too unpredictable to get the world to agree on it.\n\nNot trying to be a hater or say I don’t wanna try, but that’s my sad realist approach to it', 'Nonsense. Unsubbed. Byeeeee', 'We’ll run out of fossile fuels way before this is even dreamed.', 'Science Fantasy.  The levels of materials & energy required are hundreds of years away.', '‘ant’ling hyperspace', 'I love this kind of animations']"
xZbcwi7SfZE,"['You want to learn more about science? Check out our sciency products on the kurzgesagt shop – all designed with love and produced with care. \nGetting something from the kurzgesagt shop is the best way to support us and to keep our videos free for everyone. \n►► http://kgs.link/science\n(Worldwide Shipping Available)', 'Can our immune system take super bugs?', ""I am a PhD student researching methods to stop bacterial conjunction (the hugging described in the video) this video is so perfect because when ever I struggle to explain my work I come here and it show someone this video it's perfectly explained and highlights the dangers flawlessly."", ""I just came from McDonald's. That burger is not $1 anymore. 😢"", 'Omg the meat industry is truly destructive', 'This video has aged so well', 'Thanks really brilliant explaining!', ""Without eating antibiotics, our body takes like 1-2 weeks to heal naturally. But the modern world can't afford for you to call in sick for 2 weeks."", '“Antibiotics, we’re wonderful pills\nBut don’t ever think we’ll cure all of your ills.\nGot the cold? Got the flu? Feeling under the weather?\nThat’ll be a virus, we can’t make that better.\nTake us for the wrong thing, that’s dangerous to do.\nSo when you really need us, we could stop working for you.\nSo please don’t end up paying the price,\nPlease take your doctors advice.”\n\n“Hey\nWhat are we doing out of the bottle\nThis is dangerous\nA little kid may come along and think we were candy\nThey might even eat us!\n(No) (No) (No) (No)\nThis is serious (serious)\nWe could make you delirious (delirious)\nYou should have a healthy fear of us (fear of us)\nToo much of us is dangerous.\n(No) (No) (No) (No)\nDoctors tell the pharmacy (Pharmacy)\nTypes of pills that you will need (you will need)\nAnd they know the harm that we can be (we can be)\nIf we’re not taken carefully.\n(No) (No) (No) (No)\nWe’re not Candy!\n(Believe us)\nEven though we look so fine and dandy\nWhen you’re sick we come in handy but we’re not candy!\nNooOOooooOoOOooo”', 'Well that aged well']"
wJUXLqNHCaI,"['Head over to our shop to get exclusive kurzgesagt merch and sciency products designed with love. \nGetting something from the kurzgesagt shop is the best way to support us and to keep our videos free for everyone. \n►► http://kgs.link/shopkgs\n(Worldwide Shipping Available)', ""The real moral of this story is the US and Switzerland are not the same and shouldn't be equated.  Oregon did exactly what Switzerland did and it's worse today than ever before."", ""I don't do any drugs, but I absolutely disagree that the government banns what an adult can and cannot ingest and feel, all while alcohol is freely available everywhere, and that is the worse drug of them all! I can drink myself to death, but I can't smoke a joint?!?! Moreover the prohibitions stop any studies on drugs helping people, i.e. psychoactive compounds and cannabis, that could help so many sick people. And I do not understand why the government doesn't like people using some of these things recreationally if done responsively???"", 'The problem is there’s only a war on illegal drugs. When they legal drugs are the same thing the lines get so blurred. The real gateway drug was big pharmaceutical companies but no one cares', 'Not the los pollos hermanos making collab with kurzgesagt 💀', '""Unintended""? Only part of the video I disagree with...', 'Alcohol is a drug, and it’s worse than lsd, and shrooms, and weed, you can’t overdose on any of those, you can die on Alcohol, I’m not saying alcohol is bad, but it is a drug', 'system of a down lyrics be like', 'I love the los pollos hermanos....best chicken😂', 'Watching while high']"
LS-VPyLaJFM,"['You want to learn more about space? Check out our space products on the kurzgesagt shop – all designed with love and produced with care. \nGetting something from the kurzgesagt shop is the best way to support us and to keep our videos free for everyone.  \n►► http://kgs.link/space\n(Worldwide Shipping Available)', ""Keep in mind, that by the time the last star is around, if the human race still exists, we would have most likely evolved into beings of pure energy in one hundred trillion years! (The entire universe being around 13 billion years old right now). So yeah, we have lot's of time here."", ""We've been around for 300k years. With AI-engineered pathogens and nuclear warfare on the horizon, if we make it to 301k that would be quite the feat."", 'Best video so far,  I am watching all kurzgesagt videos', '2:51 LOL', '2:51', ""The amount of hate brown dwarfs get in this sub is rude af they're trying their best 😢😢"", 'Please do a video on Orange Dwarfs', 'Yooo guys it’s bedwars!', ""I really like the accent it's very clear and understandable. The graphics is insane it took many hours to put together and with these graphics I understand easily. thank you for this educational video 🥰""]"
