video_id,comments
F1Hq8eVOMHs,"['You want to learn more about science? Check out our sciency products on the kurzgesagt shop – all designed with love and produced with care. \nGetting something from the kurzgesagt shop is the best way to support us and to keep our videos free for everyone. \n►► https://kgs.link/shop-154\n(Worldwide Shipping Available)', ""I will never stop eating meat. I don't give a fuck about the planet."", 'Wacky idea guys, what if, and i know this is wild but, we limit our meat consumption and genetically modify what we do eat to reduce it output. But also kurzgesagt is what got me into science.', ""I absolutely love this video and love the logic behind it. However it's missing one argument. If we don't eat them, what happens to all the cows? (Or any animal/plant for that matter) They reproduce and take up land either way. This video only focuses on emissions but not the broader logic of what else we could do. It may limit our push for forced reproduction of animals to go vegan or vegetarian, but as someone in an agricultural area I see firsthand that animals can be crueler and more destructive than we think. If we don't eat them they have to go SOMEWHERE. I hope this channel can make a video focusing on that side of the argument too."", ""5:00\nThis is probably the biggest piece of disinfo Kurzgesagt has published. \n1 Natural greenhouse gasses, gasses that are released by the circle of life are eventually returned into the ecosystem. The problem has, and will always be emitting non-natural gases from permanent storage. For this the beef c02 calculation is majorly off as it includes methane production of the cattle.\n2 The pre-colonial ruminant herds and modern north American cattle herds are roughly equivalent in methane production. Meaning giving back this land to nature will certainly, not magically grow trees but be returned to bison and elk to repeat the supposed methane problem.\n3 Cows turn garbage into food. The north American cattle herd eats 70% human inedible food. This also ignores how the supposed bounties of plants we give them, even when edible is still extremely low quality and would be thrown out by most Americans.\n\n8:54\nThis is wholeheartedly dishonest. The majority of feed is again, human inedible. By saying (insert percent) is used by animals ignoring that these parts are low quality, not fit for human consumption as if they have dedicated plots of soybeans with signs declaring them animal only. \n\nNo, eating leafs won't bring us harmoniously with nature all it will do is give you nutritional deficiencies. The problem has, and always will be burning fossil fuels. This video is an anti-human reductionist smear campaign."", 'Best way to not get cancelled 😅\nBiased opinion for obvious....', ""this thumbnail is wild, a cow with hearts in its eyes? cows don't eat meat. a cow with terror in its eyes would fit."", 'Nuh uh', 'Soylent green is a good compromise for climate activists and meat eaters.', ""Is it that bad? It was for me! I had child asthma, never diagnosed, carried over to adulthood without knowing. There were better and worse months or years. When I was 26 years old, I permanently left Poland when I was born and settled in the UK. WIthin the next 5 years my health went into the dith=ch. My allergies were rampant, I was crawling from antihistamine to antihistamine, never free from debilitating symptoms, my asthma was horrible, I couldn't stop wheezing and coughing. By the time I was 36 I was a wreck. Until the GP I was working for asked my why I was not on asthma meds, that's when I found out it was asthma triggered by allergic reaction to everything. I was on meds until I was 40 when by a happenstance I tried vegetarian diet... and within 6 months I was symptoms free, within 9 months I was meds free. I'm 46 next year, still a vegetarian, without ANY symptoms since 2018. I lost 25 kilograms without any effort, dropped from size 18 to size 10 in a year. My life has changed, because I stopped eating any meat. My GP, the same as back then said I might have had an allergic reaction to everything that IS IN meat- antibiotics, hormones, accumulated chemicals... and my body was recejting it so strongly because I grew up on much more natural diet in Central Europe. The UK highly processed food was killing me. So- happy, slim, healthy, full of life, I say- yes- IT IS THAT BAD. For ME :)""]"
LmpuerlbJu0,"[""Hey everybody! Today finally marks the release of “Immune – A Journey Into the Mysterious System that Keeps You Alive”. The book I've sorta started writing a decade ago!\n\nYou can get it here: https://kgs.link/ImmuneBook – It’s available in English and German and at online retailers it should be available in pretty much all countries too.\n\nFirst we had to push the release back because of cargo trouble and then because so many of you pre-ordered that we didn’t have enough copies for the original launch day! Thank you so, so much for that! \n\nTonight I'm doing an AMA on Reddit where you can ask me about Kurzgesagt, science communication and of course the book! Join here: https://kgs.link/KGS_AMA\n\nIn any case –\xa0Kurzgesagt is a passion project and it's just so heartwarming how wholesome and supportive our community and viewers are. I'm incredibly grateful to have this job and to be able to make content for all of you, video or printed. – Philipp"", 'please make more videos of the immune system', '8:46 Harvard University but SUPER INSANE', 'IMMUNE', '“If things work out in a complicated dance……”', ""This is very informative, educative and entertaining. It's amazing."", ""I was hoping he'd delve more into the ecosystem approach, introduced and abandoned at the beginning of the video. An ecosystem understanding of the innate immune system all but nullifies the war like  description of adaptive immunity. For in a stable, biodiverse and established ecosystem, disease does not exist, it is just merely assimilated"", 'I love your idea with a bird telling everything', 'You are my favourite Chanel', 'Better than mu professor explained it']"
xaQJbozY_Is,"['The 12,022 Calendar is sold out check out more scienc-y products created with love here: https://kgs.link/shop-151', 'Love these vids sooooooooooo infinity much', '""To fill the void in your soul"" was a bit unnecessary...', 'I fucking love this video', 'Expect mosquitoes', 'The reality could be is that some dinosaurs could have looked far more alien than any of us had ever imagined, while others may have looked exactly what we think of them, but with a less intimidating twist', 'No matter how amazing all these dinasour, im glad they all dead 😂', ""Dinosaurs had big ears, but everyone forgot this because dinosaur ears don't have bones\n\n\n\n\n\n\n\n\n\n\n\n\n\n\n\n\n\n\n\n\n\n\n\n🪨And that's a rock fact"", 'Life must be created and destroyed in the development of mother nature.', 'From an evolutionary perspective, humans were originally a keystone species; that was our role in nature. \n\nBut then some of our ancestors discovered the concept of exploitation & consolidation of power, & after that our species as a whole became more destructive than anything. 💔']"
0FRVx_c9T0c,"['To preorder IMMUNE click here: https://kgs.link/ImmuneBook – Its available in English and German and on amazon it should be available in pretty much all countries too.\nOhai! I’m Philipp, the founder and head writer of Kurzgesagt and author of IMMUNE! Let me say a few words about it: IMMUNE is older than Kurzgesagt and I began working on it about a decade ago in university. The idea was to explore a super important but also extremely misunderstood and complicated topic and “translate” it into a language everybody could understand. I’ve done my best to basically write a super long Kurzgesagt video but with less of the limitations of a ten minute video.\nIMMUNE is a fascinating and fun journey through your own body, together we’ll be exploring mystery organs, murder universities, your enemies from viruses, bacteria and cancer (and how your immune system might have killed a cancer cell while you were reading the last few sentences) and the incredibly beautiful and amazing parts, cells and systems that keep you alive. After reading it you should not only gain a new appreciation for your own body but also experience disease differently. A flu or something more serious will not be this abstract thing but something you can sort of witness and imagine which mechanisms are active and which cells are doing what. At least personally, knowing how the immune system works always has given me great comfort when I felt unwell. Also 45 illustrated pages by the Kurzgesagt team make the book very pretty.\nPreorders are incredibly important in the world of books so if you are considering getting it, it would mean a lot if you could do that. Because preorders determine if a publisher will try to get the book into bookstores, so a lot of the book’s success depends on it.\nI’m incredibly grateful that so many of you have watched these videos in the last few years. And I hope you will give my first book a chance too. – Philipp', 'I have it', 'I bought the Hungarian version, thanks for making studying more fun!', 'Kurzgesagt can also make a book about space or physics and other topics', 'I have read this book and it changed my life ! Thank you so much for making the book! 😊', 'Criminally Underrated.', 'I have it got it from Barnes & Noble baby', ""Hello @kurzgesagt ! I come here to ask if there is a next book planned! I can't believe its been 2 years since the Immune release. It was truly an amazing and exciting book that I keep rereading often."", 'I ordered!', 'I think i will pick up a copy.']"
yiw6_JakZFc,"['You want to learn more about science? Check out our sciency products on the kurzgesagt shop – all designed with love and produced with care. \nGetting something from the kurzgesagt shop is the best way to support us and to keep our videos free for everyone. \n►► https://kgs.link/shop-149\n(Worldwide Shipping Available)', 'Shame on you for trying to clickbait us to this thumbnail by saying NO* . This was to attract those who deny it, ensuring you more views. You could literally have made the same video with just a different text on the thumbnail saying YES*', ""Are you serious? I may have misunderstood your perspective on emissions vs. poverty, but do you know why low-middle class countries are the highest polluters' most polluting countries in terms of greenhouse gas emissions, particularly CO2, are primarily led by China, the United States, and India. These countries have the highest levels of CO2 emissions globally:\r\n\r\nChina: As of 2020, China had the highest overall level of CO2 emissions, producing 11.680 gigatons (or 11.68 billion tons). This high level of emissions is largely attributed to the export of consumer goods and a heavy reliance on coal\u200b\u200b\u200b\u200b.\r\n\r\nUnited States: Following China, the United States had CO2 emissions of 4.535 gigatons. The U.S.'s large-scale industrial activities and its extensive use of automobiles contribute significantly to its high emission levels\u200b\u200b\u200b\u200b.\r\n\r\nIndia: India emitted 2.412 gigatons of CO2. Despite having a high total emission, it's important to note that India's per capita emissions are lower compared to other major emitters due to its large population. India's emissions are primarily from its expanding industrial sector and increasing energy demands\u200b\u200b\u200b\u200b.\r\n\r\nTogether, these top three emitters contribute a substantial portion of global greenhouse gas emissions. It's estimated that China, the United States, and India collectively contribute 42.6% of total emissions, which is 15 times the greenhouse gas emissions of the bottom 100 countries combined\u200b\u200b.\r\n\r\nThe high emission levels in these countries are linked to their large populations, industrial activities, energy production methods, and reliance on fossil fuels. Efforts to reduce emissions in these countries are crucial for global climate change mitigation strategies."", 'good luck', ""I'm forcing massive carbon tax and then travel to Jamaica as much as I can.\n private chat.. Who am I"", 'What about natural carbon capture.. Then sink it in ocean', ""Wait so we harvest their manure to fertilize our crops to feed them... Doesn't that seem a little redundant? 😅 Also doesn't I mean either more space for crops for more people eating vegan mean more cramped conditions for livestock and having all free range live stock would means less spaces for crops leading to having to eat more meat because the manure for fertilizer is necessary atleast for the near future? Until vertical farms can support the the ever growing population"", ""This clever narrative skips the basic physics of CO2 absorption of heat from the Earth, as described by physics in the Beer's-Lambert's Law. At lower CO2 concentrations (200opm) the absorption is maxed out, or saturated, just a few meters from the Earth's surface and increased CO2 does not capture more heat.  To illustrate this, when we use suntan lotion at the beach, increasing the SPF at some point does not provide further protection because the absorbing ingredient has already absorbed all the harmful UV rays. It is saturated. Likewise, burning fossil fuels and increasing CO2 cannot increase the greenhouse effect of CO2  further. This has been demonstrated in basic laboratory experiments decades ago and has been known for even longer.  Why has this information and data been removed from circulation and why have climatologists and UN ignored this basic physics before postulating numerous climate models and prognostications of doom?"", 'Sadly, humans will not care about the climate until it is gone and by 2028, climate change will become irreversible. Time to go back to 1905, I guess, if we could…', 'Conclusion : Human Extinction is only way to fix Climate Change']"
1-NxodiGPCU,"['You want to learn more about science? Check out our sciency products on the kurzgesagt shop – all designed with love and produced with care. \nGetting something from the kurzgesagt shop is the best way to support us and to keep our videos free for everyone. \n►► https://kgs.link/shop-148\n(Worldwide Shipping Available)', ""So viruses evolve like cells and will eventually construct beings composed of themselves. So human beings, but instead of cells they have viruses. And they will definitely be more superior. Like imagine if a species could touch you and turn you into small versioms of themselves, or become versions of us... It's mad glad I'm living right now lol"", 'Cartoon science', '*G I R U S* (girus chain?)', 'I love these videos even when i disagree with some of the underlying science, but it annoys the hell out of me when the narrator pronounces easy words wrong', '4:00 nightmare unlocked', 'I noticed that in every video, in the intro, the monkey holds something different every time. Like sometimes a phone, a Soccer Ball, and now, a toy virus?', ""it doesn't exist"", '""What is life""\n""Birdy dont hurt me""\nDon\'t hurt me\nNo more', 'Evolution be like: Yo, Dawg, I heard you like viruses so we put viruses in your viruses!']"
lXfEK8G8CUI,"['To get IMMUNE click here: https://kgs.link/ImmuneBook –– It’s available in English and German and at online retailers it should be available in pretty much all countries too.\nOhai! I’m Philipp, the founder and head writer of Kurzgesagt and author of IMMUNE! Let me say a few words about it: IMMUNE is older than Kurzgesagt and I began working on it about a decade ago in university. The idea was to explore a super important but also extremely misunderstood and complicated topic and “translate” it into a language everybody could understand. I’ve done my best to basically write a super long Kurzgesagt video but with less of the limitations of a ten minute video.\nIMMUNE is a fascinating and fun journey through your own body, together we’ll be exploring mystery organs, murder universities, your enemies from viruses, bacteria and cancer (and how your immune system might have killed a cancer cell while you were reading the last few sentences) and the incredibly beautiful and amazing parts, cells and systems that keep you alive. After reading it you should not only gain a new appreciation for your own body but also experience disease differently. A flu or something more serious will not be this abstract thing but something you can sort of witness and imagine which mechanisms are active and which cells are doing what. At least personally, knowing how the immune system works always has given me great comfort when I felt unwell. Also 45 illustrated pages by the Kurzgesagt team make the book very pretty.\nPreorders are incredibly important in the world of books so if you are considering getting it, it would mean a lot if you could do that. Because preorders determine if a publisher will try to get the book into bookstores, so a lot of the book’s success depends on it.\nI’m incredibly grateful that so many of you have watched these videos in the last few years. And I hope you will give my first book a chance too. – Philipp', 'This vid bouta make me say sorry to my cells', 'Books 99p on Kindle right now. 🙂', 'Amazing 💜', 'amog us', 'IMMUNE by Detmer. HNY 2024 !!! Getting the book now !!', 'That is really amazing 🎉🎉🎉😊😊', 'Only .2625% of the world population  watched this video.', 'This is one of my favorite kurzgesagt videos', 'Neutrophils be like: I may kill other cells but that’s a sacrifice I’m willing to make.']"
0FH9cgRhQ-k,"['The Black Hole story continues with our Black Hole merch, spanning the whole range from somewhat bonkers to more serious. \nCheck it out here: https://kgs.link/shop-146', 'Ultra-Massive black holes could well have existed before our universe, considering even Quasi black holes are considered to have been difficult to exist given the lifetime of our universe.', 'Phoenix A be like “CHILD”', ""Here's a thought about the curious black hole size jump. That if when black holes get to a certain size they punch through another space time and eject material to a white hole. And the closer they are to another space time the more energy they lose. Let's say a lot of the black holes used to be a pretty  close size but most of them ejected a bunch of their material at once because the other side of space time changed and got suddenly closer."", 'Black Holes are big.', 'Ton 618 lost its ranking as the King its now Phoneix A', '9:50 the music syncs really well with the greatness of the universe', 'All that power and they still can’t beat God', 'more light than ALL the stars combined in the Milky Way (which are only some 100 billion) in 4400 years. That would be so bright, the sky would literally be white.', 'Yet ton got replaced by phoenix']"
G-WO-z-QuWI,"['You want to learn more about space? Check out our space products on the kurzgesagt shop – all designed with love and produced with care. \nGetting something from the kurzgesagt shop is the best way to support us and to keep our videos free for everyone.  \n►► https://kgs.link/shop-145\n(Worldwide Shipping Available)', ""It would literally take millions of years to terraform a planet. Advanced human civilizations don't exist for that long. Within the next thousand years humans will be back in the Stone Age or extinct."", ""What about the fact that Venus can't vent out heat from its core like earth? We know it gets eventually released when its crust breaks, releasing gas in the process, but heat will build up again due to radioactive decay."", 'Its free real estate!', ""What Venus needs is plate tectonics, solve that and it will take care of the CO2, it's also required for a long term sustainable environment that's capable of self-regulation."", 'If you have infinite energy, Venus terraform is easy.  CO2 reacts with H2O to make carbonates.  You reverse the reaction that put Venus where it is today, by bombarding it with icy asteroids, which will restore the carbonates, which unlike the past will be on the surface, not in subsurface rock that the volcanism put into that atmosphere long ago.', 'how do we know the atmosphere is so dense on venus? i mean he says things but doesnt explain at all how we even came to that conclusion, thats not really learning anything.', 'probably easier to try and save this planet', 'We could potentially pull Venus into the habitable zone', ""Use kirks' wifes' genesis bomb, you know, from the wrath of khan (ricardo montalban starred as khan)...""]"
dFCbJmgeHmA,"['Ohai! So a few more words about our announcement at the end of the video. If you haven’t watched it, here is a summary: Our shop has grown a lot over the years and it is kind of a big deal for us. Check it out here: https://kgs.link/shop-144 We genuinely love creating sciency products that you can actually touch and we are constantly working on expanding it further.\n\nBecause you guys support us directly we are able to grow our team, consistently improve our research process, spend more time on fine-tuning the animations, working on improving our craft wherever possible. And release our content for free and stay independent. Genuinely thank you so much for that.', 'Jupiter really slept on that one', '5:26 yeet', 'Fresh food is scarce while fungus florish. I eat mushrooms.', ""Ya, so why didn't Alligators, Crocodiles, Monitor Lizards, Kamoto Dragons, Caymans, Turtles . . .  not get extinct too."", 'This is where we developed the indomitable human spirit', ""It's crazy to think that this extinction level event wasn't even the worst the Earth has ever had in our brief history as a planet."", 'Cap', 'in sted', 'there was a flood']"
JXeJANDKwDc,"['The script was inspired by an old article from my friend Tim Urban, who runs “Wait but Why”, the best blog on the internet, make sure to check it out. https://waitbutwhy.com It’s so easy to get lost in your daily life: there are so many “urgent” and “annoying” things that you forget that actually every day is special, sort of. And even more so the days we have with friends and family. I know watching a video like this can hit pretty hard. But at least for me, the message it tries to convey does make me actually change my behavior. Reprioritize things. You know. Hope it had a similar effect for some of you.\nAlso, if you want to track how many weeks off your life you have left or get a new perspective on this stuff, we’ve made a few posters you can check out. Getting something from our shop is the best way to support our channel. https://kgs.link/shop-143 In any case, call someone you haven’t called in a while today. And thank you for watching. – Philipp', 'PESADO.', 'This video is a reality check personally for me! Thank you very much for creating meaningful and insightful content like this! God bless you! 🙂', ""6 years on depression meds, questioning life all the time, making everything complicated, searching meaning everywhere.\nwhere were you? Why i didn't know about you?\nThank you so much❤\nMay be its the tear of happiness or the eureka moment\nThank you❤"", 'Why does this have so many views ????', '❤', 'watching this after my Dad unexpectedly passed away 3 months ago. i don’t know how i feel', 'But the most important thing is that you make a decision.\n\nThat hit hard. 💯', 'Someone who has watched this video statistically probably died this week..', 'jjss']"
