video_id,comments
6AWYgNArZZw,"['That alolan Exeggutor at the end is gold 😂', ""no, if you are cutting half of the mass of earth, there would be less gravity.\nBut if you compress or shrink Earth, then gravity will increase as all the matter in earth is closer together, and their attractive forces pull on you more.\n\nAlso, if you are just cutting the mass of earth in half, it likely won't spin faster as the mass wasn't pulled in, just cut in half"", 'I love the alolan exegutor in the background at the end', 'What if it was smaller, but still dense enough to have 1g.', 'Hi', 'Wonder how this would look if the earth was just compressed to half its size. Same mass as current earth', 'About rotation I agree, about gravity I disagree', 'What about 2x size 🧐', ""I can never understand the witches' role in the story. Do they still watch over Earthbread like we would with a bowl of goldfish?"", ""How about 'moon'?""]"
Chh2lgGe2YE,"['Always wash out your mouth before and after use.', 'Jürgen', 'Yummy yum yummers', 'Wait people didnt learn this in school?', 'Your art style looks soo wierd and gnarly', ""In developing countries they refer to that pill as the bomb. Used to be the size of your top thumb knuckle and you'd still be sharting your brains out when you got back to the States"", 'One Pill for an 8 meter long worm', ""arent it gonna doe because of my digestive system? or it isn't strong enough to kill it?"", ""Sigh... I'll get the flamethrower...."", 'For the bloody algorithm!']"
qP65siuTLFc,"['“So we can’t recommend…cooking a chicken with a particle accelerator”🥶🥶', 'Mega mayto', ""You guys gave me existencial dread so you won't deny me trying out the forbidden chicken recipe"", '죽여주는맛', 'Bird cooked bird bruh', 'I saw a megamato', '""Then, we need a particle accellrator.""\nC\'mon, another recipe with those fancy expansive tools? Can\'t we get something that\'s more affordable for us common folks?', '""Ayo look who fell asleep first.""\n""Prank \'em, John!""\n""Haha, you already know!""\n**proceeds to put into particle accelerator**', '...', 'mmmm yummy radioactive chicken']"
Z_1Q0XB4X0Y,"['This video was sponsored by GiveWell. \nFirst-time donors will have their donation matched up to $100 at https://www.givewell.org/Kurzgesagt', 'just more paradoxes that lead to a creator... just saying 🤷🏾\u200d♂', 'Since going close to the speed of light slows down time, does that mean if you pass the speed of light you can hypothetical time travel?', 'Hay so I just saw your minde upload video and I wast wondering is it possible to do the opposite asen uploading AI into a biological brain, another question is it possible to code  ai to not just express emotion but to also fell the emotions using code ad is it possible to grow an interest humane brain frome scratch by growing neurons in a lab las question can you upload your minde into another brain', '""Medium size city like lisbon"" PORTUGAL!!!', 'I love the way this video was done, and as always the graphics are brilliant 😁', 'That was expletively excellent!', 'But am i in the middle or is my view in both directions just similarly limited?', '""We are simplifying so much, its like a lie anyways."" i love it.', ""You totally waste your time on the channel in Arabic. 30k+ subscribers only. Just be sure that arabs follow and watch stupid stuff on Internet more than the useful ones. \n\nKorea is one country and arabs have 20+ countries and the korean channel has more viewers than the Arabic channel.\n\nTrust me they're so busy watching the most useless videos in tiktok.""]"
nGggU-Cxhv0,"['Go to https://brilliant.org/nutshell/ to dive deeper into these topics and more with a free 30-day trial + 20% off for the first 200 people! \nThis video was sponsored by Brilliant. Thanks a lot for the support!', 'Literally cried to this video, realizing that my body is the person who loves me most in this world. Thank you kurzgesagt for making this video.❤️🥹', 'probably not the best ""minority inclusion"" move to put the name mohammad tattooed on the female\'s back 😂. tattooes are not allowed in Islam.', ""- [00:00] 🩹 The Conveyor Belt of Death\r\n\r\n  - Your skin's outer layers are a conveyor belt of dead cells, constantly replaced by new ones.\r\n  - Stem cells in the skin industrial complex produce new cells that move from inside to outside.\r\n  - The process involves the production of Lamellar bodies for a waterproof coat and shedding of dead cells.\r\n\r\n- [01:51] 💥 When the Fleshy World Explodes\r\n\r\n  - The dermis, below the conveyor belt, is where a tattoo is placed, filled with blood vessels, immune cells, and structural tissue.\r\n  - Tattooing involves monolithic needles breaking through layers, causing violent destruction and immune response.\r\n  - Macrophages in the dermis react to the wounds, defending against bacteria and dealing with the flood of tattoo ink.\r\n\r\n- [03:39] 🌌 The Battle Inside Your Body\r\n\r\n  - The immune system faces a battlefield with chemicals, dead cell parts, ink particles, and immune cells.\r\n  - Macrophages attempt to engulf and dissolve ink particles but struggle due to their composition.\r\n  - Immune cells eventually concede, trapping ink particles in themselves, creating a permanent but hidden prison.\r\n\r\n- [05:27] 🔄 Actually Nothing is Forever\r\n\r\n  - Macrophages hold tattoo ink in place, creating the appearance of a permanent tattoo.\r\n  - Over time, Macrophages age and die, leading to some ink escaping and causing fading.\r\n  - Removing tattoos with lasers breaks down ink particles, but Macrophages continuously try to lock them in place.\r\n\r\n- [06:54] ❤ Your Body's Love Letter\r\n\r\n  - Tattoos showcase the continuous protection provided by your immune system.\r\n  - Understanding the internal struggle makes you appreciate the sacrifice of immune cells.\r\n  - The video emphasizes the importance of knowing and appreciating the functions within your body."", ""does anyone understand why my tattoos have raised like bumps? is this because of the 'death conveyor belt'? starting to stress me out a little and no one seems to know what's going on"", 'Wow, that just killed all of my dreams to get tattoos', ""Fun fact: Christiano Ronaldo haven't done any tattoos because with them you can't donate your blood. Very good example for everyone."", 'Not making any tattoos on my body ‼️', 'Human Immune system is the most irl thing Warhammer will ever be', '3:09 AMOGUS']"
HR2C_7G_yRQ,"['✨ LAST CHANCE ✨ Order your 12,024 Cosmic Creations Calendar (our most spectacular yet!) to receive it in time for the holidays: https://shop.kgs.link/12-024-Holidays\nThank you so much for being a special part of all that we do here at kurzgesagt!', 'You left out vacuum decay of the Higgs field, which is weird because you made a video about it.', 'Thanks\nThis information was super useful, works 😃', 'I have a feeling existence and everything is like a phoenix cycle, everything collapses, then boom! The Big Bang happens again, but all intelligent life has no idea about anything before that. Everything could have happened over trillions of years, but gets reset every fifty billion years or so.', 'Solve for the variable', 'I just subscribed😢 so happy', 'Hello', 'Begins tomorrow is coming with me dinner and just come I am in the time machine and then going back to 1980s but where I am now I went further than there but I went back in the day you know what I mean being was actually for Laura I’ll type in the year998654211136899009765432355555542232211124689998753322,36455522224689,209,89,2082 yep that one', 'No the world is not going to end like that it is going to end when our lord and savior will come and destroy the earth and take the believers to heaven by the rapture. And the world was not created by the big bang god created the universe and the earth and created light and darkness', 'I’ll be right back']"
yDMZJ7LgrGY,"['✨ LAST CHANCE ✨ Order your 12,024 Cosmic Creations Calendar (our most spectacular yet!) to receive it in time for the holidays: https://shop.kgs.link/12-024-Holidays\nThank you so much for being a special part of all that we do here at kurzgesagt!', 'great videos even as a teenager who is generally not interested in this the videos really interest me with the titles', 'currently in bed hugging duck plushie', ""Got my 12,024 calendar for Christmas, I don't even want to write dates on it, it is so pretty!"", ""You guys at Kurzgesagt are simply slaying it! More than just a channel, it's an education, an inspiration."", ""Ah yes, when Kurzgesagt discovered that the only thing more inescapable than a supermassive blackhole was captialism. I'm glad you found financial success and can make more videos than you did at the start!"", 'Turkish subtitle please', 'I mean yall got plenty of money from bill and laura gates.', 'But the warrior figured out there is far more pleasure in in making things grow then cutting them down', 'Hij']"
fuFlMtZmvY0,"['Go to https://ground.news/nutshell to compare news coverage from around the world and across the political spectrum to get a well-rounded view on important issues.', ""Wouldn't  a similar process happen due to the forced integration of peoples with radically different cultures in real life as well?"", 'So what happens if most people are polarized between two teams but a third way of thinking that takes from both sides is introduced?', ""Welcome to the internet! Have a look around.\nAnything that brain of yours can think of can be found.\nWe've got mountains of content! Some better, some worse."", 'This guy just explained every comment section ever in just over 11 minutes!', 'So discord severs basically', 'This channel is run by sellouts.', 'creo que tengo una opinion privada', ""I'd agree, but most conversations dont even go as far as to discuss opinions. Most people on the internet are just toxic, rude, ignorant, selfish, and full of hatred. They spew hate, curse, and give death threats for no reason to strangers. The problem isnt social media, it's people. It's not our tools, it's how we use them."", 'this makes me want to throw away my computer and start helping more poeple']"
FgnjdW-x7mQ,"['Get 50% off your first month of KiwiCo at https://www.kiwico.com/kurzgesagt with code KURZGESAGT.  \nThis video was sponsored by KiwiCo, thanks a lot for the support!', ""This is why it's pointless to worry if you ever will have kids. The species is going to die off one day anyway - through the end events in this video, if nothing else (and personally I think sooner, but that's another topic).  So live your life, knowing that even if you don't ever have kids, you can still find some degree of contentment."", 'I hope that it will be like in Futurama, that the time repeats after the last thing dies.', 'So longed for 😢 .  Waiting impatiently.', 'How the fuck does this guy know every thing is this dude god or some shit', 'I figure the universe is the result of a single firework set off by some teenager of a race of unimaginably huge beings.  The few milliseconds for the explosion to complete and the sparks to go out is to us, the entire life of the universe.', '2:24 of course they would roast the brown dwarves whenever they appear.', 'I mean if we make that far we maybe making stars', 'Law of Conservation of Mass: 👁️👄👁️ Bruh', 'Mother of the Last Thing, pray for us sinners now and in the hour of our death. 🙏☠️']"
tybKnGZRwcU,"['✨ Join the Galactic Club: your cozy corner in the vast universe ✨ https://shop.kgs.link/galactic-club\nGet everything you need to fit right in with our brand new Limited Drop – available worldwide, and ONLY on the kurzgesagt shop! Stocks are highly limited, so don’t delay!', 'Humans.\n\nUgg...', ""Let's face it humans will do option 2 because we have a hard on for long-range artillery."", '2:20 tintin rocket lol', 'Surprised that autonomous self replicating robots with a planned obsolescence isn’t the best solution plus it saves a planet for colonization depending on the scale of destruction', 'I could solo every universe at once', 'Non of these weapons effectively removed the Earth, which was the goal established.', 'To win alien war or alien invasion, what we human can do is only one, believe emperor of mandkind will protect', 'we will build a star laser', 'smopions and humas war']"
S7TUe5w6RHo,"['Learn more about how complex life evolved with our new, elaborately detailed Timeline of Evolution Poster. \nAvailable only on the kurzgesagt shop here: https://shop.kgs.link/timeline', 'Absolutely amazing!', 'Aliens is not in the mood now 😔', 'These graphics are insanely mesmerizing! Nice job!', ""This is without a doubt the best channel on YouTube, seriously. \nI can't thank you enough for all this work that you bring to us for free. It really is insane.❤"", 'hot tunes time bandits  .. i used to watch these with toddlers .....now there at uni ....thanks for help making my dreams come true ....much respect DAn', 'Amazing. Thank you!', 'To believe this guy knows how old earth is and that it is over a billion years is a testament to how dishonest and prided he is and how ignorant and gullible those who believe him are.', ""The fact that im in awe when knowing someone born around 1900s, thats like 120 years ago, and this vdeo said, we've witness things happend in billions years..  billions.."", 'bill wurtz feelings']"
Qtmrp_4BKRQ,"['✨ WORLDWIDE SHIPPING AVAILABLE ✨ The 12,024 Human Era Calendar has landed! https://shop.kgs.link/12-024\nJoin us on an exploration of how different cosmic conditions could shape unique worlds and civilizations.\nStocks are highly limited, so don’t miss your chance to own a truly special piece of kurzgesagt.', 'I cant belive I hold this calender in my hands right now, its so magnificent ❤', 'Trust me I will', 'Damn...  10 bucks of shipping costs... Why so much? :(', 'The human era starts at the beginning of the Holocene 12,023 years ago', ""I hope I can one day buy something, perhaps soon, at least some stickers and contribute to this amazing channel I've been following for years and adore a lot!\nBTW I'm so curious and would love to see a content video about AI, its evolution and how you think it could change humanity's life or even Earth. Same about nanotechnology"", 'Who else is copping this masterpiece\n\n |\n\\/', 'Humans, as a species, do not have much time left...\nThank you for sharing the knowledge, but always remember that money is evil!', 'Currently pursuing a STEM degree in computer science and this channel has always helped me stay motivated and in love with computing, math and science. Great to see how far you guys have come.', 'Is this years calender the thicker cardstocky one? \n\nLast years calender was lovely and im continuing to buy them if i can either way.\n\nBut i did enjoy the thicker cardstock. It was much easier to have leaning on my desk and could be turned into lovely posters and such']"
JOiGEI9pQBs,"['✨ WORLDWIDE SHIPPING AVAILABLE ✨ The 12,024 Human Era Calendar has landed! https://shop.kgs.link/12024\nJoin us on an exploration of how different cosmic conditions could shape unique worlds and civilizations.\nStocks are highly limited, so don’t miss your chance to own a truly special piece of kurzgesagt.', 'Hey, happy Twelvety Twenty Four everyone!', 'Be humble, for you are made of earth 🌿🌎\nBe noble, for you are made of stars ✨️🌌', ""Cool idea but it lands heavy on the earth being as old as we think it is.  The age of the earth keeps getting older the more we advance our technology. If we discover earth is 10 billion years old then this theory doesn't hold up as much"", 'The image of a galaxy looks eerily similar to a human brain when compared.   What if we are just a cell inside of a huge being (or we are very small) kind of like that men in black ending.  The big bang was the birth of this giant being.', ""So that's what they mean by a long time ago in a universe far far away"", 'I like strawberrys', 'Life just add water.', 'cap', 'I love this channel. Each video makes me think from perspectives ive never thought and is so mind opening. It feels like i gain a third eye or something wjen im watching or listening. This video in particular really amazes me. Thank you Kurzgesagt, keep up the great work.']"
LBudghsdByQ,"['Go to https://brilliant.org/nutshell/ to dive deeper into these topics and more with a free 30-day trial + 20% off for the first 200 people! \nThis video was sponsored by Brilliant. Thanks a lot for the support!', 'I think Western Conservatives have been warning about population decline for a long time.', 'Google ""Universe-25"" experiment', 'The Arab countries, specifically the Islamic countries, will not be affected by all of this because of the nature of their traditions towards the family', 'Immigrants might have been a solution if they were really willing to integrate. But as mentioned in the video, different values and mindset cause friction between the social groups which then triggers multiple secondary questions about saving cultural heritage.', 'I’m a woman I’m not inclined to have  kids because the lack of safety in female health care. lack of child care, child seen as damp on careers. Lack of child safety no space were kids can be as part of society. I do want a good number but it’s not something I can see as possible', 'This is literally the idea behind the movie ""Idiocracy"", the idiots keep having kids while the ""smarter"" people stop having kids so the future is filled with idiots. Thank God I won\'t be around to see it.', 'The unpredicted consequence of overpopulation: rapid depopulation. Maybe this part of the way the ecosystem has evolved to regulate itself - maaaaybe this was always inevitable.', ""I'm from Iran and these days we have major people like lack of fresh water, high rent price and unemployed and because of these, young people don't want to have a child in this terrible situation. Population growth is only good for government to have cheap labor force"", ""There's no problem since there is robotic development, and natality program (the contrary of wokism). Immigration =/= the solution, just an investment to increase civil war probably.""]"
BxXzzAEEhCA,"[""There's no way this would work. With that many generations, someone would probably be angry enough at being forced to live their life in this way to sabotage it at some point along the line"", 'How is that much different from living on Earth?! You still have to maintain the ship and nobody asked you to be born. It is just a much much bigger ship that we can’t steer.', 'Whoa imagine seeing mew out the window but not recognizing it because it’s several generations from when pokemon was released', 'I would not go on a generation ship. It would be boring af.', ""I didn't expect to see deoxys speed at the start"", ""Uh... doesn't being born and growing up in space cause insane health defects? So wouldn't this be basically impossible?"", 'There sacrifice will be for the glory of the 1st Great Human Empire', 'DEOXYS', 'My parents already decided more or less what my life was going to be like, to the best of their abilities .', ""I didn't choose to come to the United States my great great grandfather did""]"
4Stzj2_Rlo4,"['To get started planning a fulfilling career that does a lot of good, go to 80000hours.org/kurzgesagt for your free career guide.', 'I dont know about floating brains but mine exploded thinking about this🤯🤯🤯🤯', ""Actually I dont think I'm real !"", ""Y-yeah, well, im British. W-we call it maths so therefore, y-your argument is fake and I'm a-alive!"", '1 + 1 = 💀', 'oh my god thank you so much  i was so afraid of the end of the universe but this makes not fear the death of the universe you most likely destroyed  my existential crisis. my gratitude is eternal', ""good story , but the funny thing is that in the end , few years maybe tens maybe months , you'll meat the intilligente designer that found you and was laughing while you guys were making the video on how much thing you think of instead , facing almighty god will be crucial and stupid to face with such broken ideas .good luck"", ""You''re blending the interiors of Kerr black holes with Boltzmann Brains, although it's important to note that these states need not accompany each other. A bunch of shredded elementary particles on the interior of a ring singularity may just follow whatever the physics of the above universe dictates, including the formation of galaxies in ours with three spatial dimensions and one temporal. Black holes eventually form under our local set of physics and the process proceeds concentrically. Our existence could easily be real, but inside a black hole, or fake, and hallucinated inside a black hole."", 'My head hurts now', 'The word Probably at the last hit hard to the core 😂']"
wmP3MBjsx20,"['Join us over on Discord to discuss and share your thoughts: https://kgs.link/Discord', ""Nuclear war will never happen because everyone knows if you launch a nuke at someone you'll get 2 in return then you send 4 back and they send 8 and next thing you know earth looks like mercury and no matter how crazy you are you must no there is no winner in a nuclear war and there never will be. All nukes are is something to be used as a threat or a deterrent and nothing more"", 'I am in a bathroom break 😂', 'At the end of the video. You have the power, yes in the US, EU, sometimes India. Not in china, NK, or Russia. The only thang that will work against them is MAD!', 'WHAT IS ICBM? ALSO, WHY NOT DESTROY ALL NUCLEAR WEAPONS???', 'Gandhi lore:', 'If I remember correctly, not all nations put all the nuclear power into hand of only one man like the United States.', ""I think that today's nuclear charges are already installed where they are supposed to detonate.  They are installed in perfectly sealed  and undetectable tunnels.  I wouldn't be surprised that Israel has quite a few in several Western capitals, and that quite a few Bin Ladens also have theirs.  Therefore the president would already be sitting in a 100% bombed city and already dying from radiation sickness before being informed of any war waged by any one.  If Russia and China have any real hostile intentions against the US they will do everything in one millisecond.  Their best strategy will be first to keep the US army busy with an already life-threatening civil war without apparently taking sides.  Then at the point where everybody in the WH and in the Pentagon is overworked they first explode the Yellowstone supervolcano and while the panic is going on they explode a dozen of cities on each coast with contradictory messages from terrorists claiming their havoc.  Russia explodes three of their own cities just to have less people to feed and seem a victim of the same catastrophe."", 'This really upsets me', ""And round full circle we come to the Fermi paradox on why there are no space faring aliens. Honestly, you could add just 'war' to environmental collapse because it's also a man-made phenomena that will only get deadlier until everyone has nukes, tailored germ bombs and someday nano tech etc. Even peacefully we are running out of soil and clean water, and eventually we will fight over that. So what's more likely, humans will all live harmoniously in a global Empire that is somehow not created by war or we will die trying to make one with war? Because without unity everyone arms up and does their own thing, but to achieve unity you need to destroy and then control everyone. Won't those be the worst kind of space faring aliens if they exist?""]"
cFslUSyfZPc,"['Go ‘beyond the nutshell’ at https://brilliant.org/nutshell/ and dive deeper into these topics and more with a free 30-day trial!\nThis video was sponsored by Brilliant. Thanks a lot for the support!', 'If you destroyed the event horizon by over feeding or over charging it, could you reverse the procedure? IE for Overchanging, throw positrons at it to reverse the negative charges?', ""I've already seen the singularity, it's in the bottom of the Nutella jar 👀"", 'You get all the loot it collected', 'The singularity is in its superpositions', ""This is the 4th time watching this and I'm still trying to understand how singularity swaps space and time."", 'I would have thought the faster it spins, the smaller the event horizon would be', 'anti-gravity', 'there are white holes', 'Black babies if you dont pull out.  Or atleast half']"
Kr57ax0OWMk,"['Continue learning about the fascinating world of biology with our Human Cell Poster, exclusively available here: https://shop.kgs.link/human-cell', ""I wonder if someone could dig up old corpses, and somehow awaken the virus again.\nIf it happened in today's context… I really doubt certain countries would collaborate, meaning it can all return. Sad to think about."", 'I love this channel', 'So one of two examples of virus is in russia... Well, fuck ...', 'Turn me into a cell sized human with a flame thrower.', 'Good thing there\'s childhood vaccinations to stop people from getting stuff like measels, mumps, and rubella 😁 oh wait, the anti-vax people are stopping that. ""I never got any of those, so I\'m got giving my child the vax for that!"" They protest 😒 well yeah, you probably got the vax when you were too young to even remember! Smh', 'Apes with pointy needles', 'What about chicken pox?', '0:23 And to thank the cows, we got rid of rinderpest for them.', 'Haha told you graverobbing was a bad thing . 😅😂🤣🙏🥰🥰❤️&Understanding . It,s ok to dig up  ancient sites  but stay away from the graves . Most ancient graves still have dangerous bactetia or curses  protecting them.']"
