video_id,comments
oakWgLqCwUc,"['Head over to our shop to get exclusive kurzgesagt merch and sciency products designed with love. \nGetting something from the kurzgesagt shop is the best way to support us and to keep our videos free for everyone. \n►► kgs.link/shop-117\n(Worldwide Shipping Available)', 'это видео делал Крош? \nKrosh made this video?', ""Haven't they done studies that if you incorporate the dairy farm as a whole its carbon neutral. Since the corn, grains and hay sequester carbon and the manure gets put back into the soil. If its pasture raised cows its carbon negative?  Isn't making soy milk and growing lab meat way more of a carbon producer then just having a cow?"", 'I love milk', 'Love how  oatmilk was first place!🥇,ayyye WILLOW if your reading this somwhere,this video is for you😂 te amo❤', 'Better than Mountain Dew or Monster Energy', 'It is simply unfathomable to me that 65% of people cannot consume milk. I have lived around 8 or so cities in India, and I have observed everyone and their dogs consume milk. Either with tea / coffee or with additives. That alone should be like 15% of population worldwide.', 'go vegan', 'good video', 'Happier cows make better tasting milk']"
v3y8AIEX_dU,"['You want to learn more about space? Check out our space products on the kurzgesagt shop – all designed with love and produced with care. \nGetting something from the kurzgesagt shop is the best way to support us and to keep our videos free for everyone.  \n►► http://kgs.link/space\n(Worldwide Shipping Available)', 'idea is good. but if we are this advance an if we can use this much of energy, then its better to destroy the asteroids and incase of supernova a shield which absorbs all the energy is way better\nbut still this is cool', 'Ab dekh \nAb dekh \nAb tu gaya \nSun ab tu gaya', 'Wait photon has mass?', 'The ultimate space ship', '“What if we took [the solar system] and pushed it over there?”\n\nPatrick was on to something', '“ more like a skating ring, filled with drunk toddlers”.   Got me dying on the floor.😂', ""Talking about moving the solar system while most men aren't thinking passed trying to get laid (women are so under represented in STEM they're not worth thinking about).  Fewer and fewer people are even willing to put in the effort to have Families, never mind projects that take multiple lifetimes!   It's funny and sad at the same time!  \n\nHey Kurzgesagt!  Do a vid on how we as a society can motivate our male populations to think more about the future instead of just sex and drugs!"", 'Then we would have to go to Mercury to make a dyson sphere witch means to dissasemble Mercury apart', 'Then is it possible to build galaxy engine?']"
NMo3nZHVrZ4,"['Head over to our shop to get exclusive kurzgesagt merch and sciency products designed with love. \nGetting something from the kurzgesagt shop is the best way to support us and to keep our videos free for everyone. \n►► http://kgs.link/shopkgs\n(Worldwide Shipping Available)', 'I find this ironic at a time when most ""developed"" countries are facing a demographic collapse following decades of reduced birth rates. It\'s not about the number of children, but the opportunities that are available to them.  Africa has always been marred by wars, corruption, and lack of efficient transportation over such large distances.', 'They benefited from colonization. In fact it should have never stopped', 'He talks about Sub Sahara Africa, but what of the northern edge?', ""So... its 2023... let's talk about the Congo. 🔍👁👁"", 'Free Congo', 'But... Africa is not a poor continent. The problem is the corruption and the neo-slavery that European countries like France, that are taking their natural resources in exchange for pennies and the presidents of African countries that have politics that betray their own people.', 'BRO THE TITLE IS CRAZYYYY 😂😂😂', 'When the West is forced out of Africa improvement will follow.  The theft has continued on a large scale throughout Africa along with genocide and forced labor. Colonialism never ended.', 'Nadmiernie się mnożymy, a następnie wyżynamy o ziemię i zasoby - No chyba że uprzedzą nas naturalne mechanizmy przeciwdziałające nadmiernej rozrodczości, jak choroby, pandemie i głód.\r\nWybór jest prosty:  Albo żyć w niewyobrażalnej szczęśliwości w Rajskich warunkach - ale zachowując harmonię demograficzną. Albo nadmiernie się mnożąc zrobić piekło dla siebie i innych.']"
WPPPFqsECz0,"[""Ohai! For a change a few personal words. My name is Philipp and I started this channel almost seven years ago – you don’t know my voice but you have heard my words because I write most of our scripts.  Oh boy. This was a hard video to make. Gratitude felt vaguely risky to do as a topic. It has this aura of cheap Instagram hashtag self help stuff.   Some of you will hate this video deeply, and the thought of that made me pretty anxious writing it. Gratitude was not supposed to be a video topic originally. Just like the Nihilism and Loneliness videos, the script was based on personal struggles and part of the process of dealing with them. And so it felt right to make gratitude a video too.  But Kurzgesagt is not a self help channel, so we'll keep this sort of content at roughly one or two per year.   We hope they are helpful to some of you.   If you care for my take on how to practice Gratitude, we made a Kurzgesagt Gratitude journal to combine the science with practical tips. https://shop.kurzgesagt.org/ Edit: PRE-ORDER is available again.  Please note: You don’t need to buy this or anything else to practice gratitude – you only need a pen, a piece of paper and 5 minutes.   Thank you for watching our videos and reading this comment. Being able to do Kurzgesagt means a lot. To me and the whole team. – Philipp"", 'very helpful <3', 'Honeslty ... This feels impossible.', 'Thank you for this video. 😄', 'amazing', ""I was surprised by the fact that the minds of happy individuals compare past difficult moments with their current situation and feel gratitude. Because, in my case, it's the opposite. I used to have good times in the past, but now I feel sad thinking that things are not going well. Or, I had difficult days in the past, and now, thinking that my life will never improve, I find myself saddened once again."", 'Looks like someone is a pokemon fan in the animation team.', 'Grateful for this channel <3', '전적으로 공감합니다. 현재에 만족하고 감사해요.', ""But what if you simply don't like life 😏""]"
dqwpQarrDwk,"['You want to learn more about space? Check out our space products on the kurzgesagt shop – all designed with love and produced with care. \nGetting something from the kurzgesagt shop is the best way to support us and to keep our videos free for everyone.  \n►► http://kgs.link/space\n(Worldwide Shipping Available)', 'I always thought that combing this with a more advanced version of Project HARP would be the best way forward. The Space Gun would fire small satellites into low earth orbit where they would either stay or boost up to be caught by a skyhood to either bring them higher or send them to another planet.', 'Is it expensive', 'Very intelligent idea! What u could also do is a series of skyhooks, call em hookshots, in a line in orbit. Like a monkey that swings from branch to branch, each hookshot propelling a craft faster and faster so u can get to ur destination in 1 day lol', 'The Axalatal Theory? 😶', 'Just imagine overloads the passengers will experience while spinning at Mach Jesus around a moon.', 'This is a very hopeful and cool concept, but considering that ""nothing is stopping humanity..."", people should be aware that there is a lot of space debris orbiting around the Earth, with little being done to remove it. Humans might as well hinder their ability to develop cool things like the skyhook if they don\'t solve this immediate problem first!', '👍🏻😎🦝👽', 'You should fw this to elon musk , i think its brilliant plus the whole hitch hikers guide to the galaxy animation a plus', ""The Mars tether is attached to Phobos - so we'll need to build something like a perfectly circular railroad track around the equator of the moon, with very low friction? Then we need THAT track to be able to rotate over Phobos's surface on an axle pointed at the center of Mars to be able to aim the plane to line up with the incoming ships or destinations. To further complicate that construction, Phobos is irregular, not spherical. For receiving, we'd ALSO need to deal with what happens if Mars is blocking the path to the tether as it's coming in? While it does orbit pretty fast, I'd expect the window to catch the tether would be rather short.\n\nFor the record, I'm a mechanical engineer, not an astrophysicist!""]"
udFxKZRyQt4,"['You want to learn more about space? Check out our space products on the kurzgesagt shop – all designed with love and produced with care. \nGetting something from the kurzgesagt shop is the best way to support us and to keep our videos free for everyone.  \n►► http://kgs.link/space\n(Worldwide Shipping Available)', 'in 0:53 it looks like a candycorn', 'Sun slice: forbidden candy corn 😋', 'Can iron even exist at the centre of a star without boiling', '👅', 'UHMMM GOODLICKKK', 'int the center', 'you could kill a star we have iron in our body so that means you could make it explode', 'a cool thing', 'If Our solar system was made of a neutron star, and a strange matter actually existed. That would mean all the strange matter may be found inside of Saturn, because of its strange hexagonal shape at the top North Pole of the planet. strange matter may be found there,  because it keeps growing']"
5iPH-br_eJQ,"['Head over to our shop to get exclusive kurzgesagt merch and sciency products designed with love. \nGetting something from the kurzgesagt shop is the best way to support us and to keep our videos free for everyone. \n►► http://kgs.link/shopkgs\n(Worldwide Shipping Available)', 'One of the best and important videos I have ever watched', 'Nuclear weapons are extremely destructive and have devastating consequences. The use of nuclear weapons is considered a highly controversial and unethical act due to the immense loss of life, long-lasting environmental damage, and the potential for triggering a global nuclear war.\r\n\r\nIf a city were to be targeted with a nuclear weapon, the immediate impact would be catastrophic. The intense heat and blast wave caused by the explosion would result in the destruction of buildings, infrastructure, and densely populated areas within a significant radius. The number of casualties would be enormous, with immediate deaths occurring due to the blast, heat, and radiation exposure.\r\n\r\nThe survivors would face numerous challenges, including severe injuries, radiation sickness, and long-term health effects. The infrastructure necessary for essential services such as healthcare, transportation, and communication would be severely compromised, making rescue and recovery efforts extremely difficult.\r\n\r\nThe long-term consequences of a nuclear attack are equally devastating. The release of radioactive fallout would contaminate the surrounding area, making it uninhabitable for an extended period. The environmental damage, loss of biodiversity, and contamination of water sources would have severe implications for the ecosystem.\r\n\r\nFurthermore, the psychological and societal impact cannot be overstated. Survivors would face trauma, grief, and the challenge of rebuilding their lives in the aftermath of such a horrific event. The international community would be deeply affected, leading to political instability, increased tensions, and potential retaliatory actions.\r\n\r\nIt is important to note that the use of nuclear weapons is internationally condemned by the majority of nations. Various treaties and agreements, such as the Treaty on the Non-Proliferation of Nuclear Weapons (NPT), aim to prevent the use and spread of nuclear weapons and promote disarmament.\r\n\r\nOverall, the use of nuclear weapons is a grave and destructive act that should be avoided at all costs. The focus should be on promoting peace, diplomacy, and finding nonviolent solutions to conflicts.', 'Question: how do they make those nukes?', 'The problem is without nukes countries will invade eachother causing much more death and suffering then a bomb ever could', 'damn i would just choose to evaporate by the blast than suffering from the radiation', 'You got me at nuke-', 'it is terrifying what humans are capable of', ""I want to see a town or a whole state that faced a nuke, i'd like to explore it, it'd be like fallout"", '?']"
cqECNYmM23A,"['You want to learn more about science? Check out our sciency products on the kurzgesagt shop – all designed with love and produced with care. \nGetting something from the kurzgesagt shop is the best way to support us and to keep our videos free for everyone. \n►► http://kgs.link/science\n(Worldwide Shipping Available)', 'This is the craziest video I’ve ever seen on youtube', 'California carpenter ant: YES! I just killed 22 Argentine ants!\n\nThe 76 that just hatched three seconds after the California ant said that: 🗿', 'please do another ant video', 'Ah yes, putting a piece of old food in between two different ant colonies. The original Top-down war-sim game.', 'Imagine one day the right mutation occurs which results in ants forming an an Ant United Nation and them declaring war on humans 😅', 'Im from argentina so im happy that they are from where i live', 'Anyone else get itchy watching this?', '🇦🇷🇦🇷🇦🇷🇦🇷🇦🇷🇦🇷🇦🇷🇦🇷', 'Aaaakkkkk']"
PaErPyEnDvk,"['You want to learn more about science? Check out our sciency products on the kurzgesagt shop – all designed with love and produced with care. \nGetting something from the kurzgesagt shop is the best way to support us and to keep our videos free for everyone. \n►► http://kgs.link/science\n(Worldwide Shipping Available)', 'Why is no one mentioning ponyo’s mom at 1:50?!', 'You’re the better version of the infographics show', 'pokemon', 'I love the references here, like the Granmamare from Ponyo, a Japanese film. 1:51', ""I'm a fourteen year old kid who doesn't even want to do chores and homeschooled with a problem of not doing home schooling,\n\nand yet, without my mom's knowledge (she's at work so I can't exactly tell her) I signed up for Brilliant because this creator who I watch when I'm working on my little book caught my attention a few months back with black holes — and now I'm learning stuff I'm actually interested in."", 'That biomass distribution is very interesting.', 'Editing is nice', 'The quality.....oh my lord..❤', ""We're those pokemon in the ocean?""]"
h6fcK_fRYaI,"['Head over to our shop to get exclusive kurzgesagt merch and sciency products designed with love. \nGetting something from the kurzgesagt shop is the best way to support us and to keep our videos free for everyone. \n►► http://kgs.link/shopkgs\n(Worldwide Shipping Available)', 'Wow', 'thank you for being my peace', 'I want to change my current character and waiting for death is boring, the best way would be to choose the shortcut, bye.\r\n(I hope I come as Elon Musk :D)', 'Damn already 4 years 😕', 'It’s crazy how I watched this 30 MILLION times 😯 😯.', 'The line “All religions are right in their own way” goes *hard*', ""This video is absolutely amazing, can't believe I've done it!"", ""Bunch of miserable christians here in the comments can't even fathom the thought of enjoying a good story yet seem to speak of the bible like it isn't just one big story. This is a great video. 😌"", 'Find music']"
7_e0CA_nhaE,"['You want to learn more about science? Check out our sciency products on the kurzgesagt shop – all designed with love and produced with care. \nGetting something from the kurzgesagt shop is the best way to support us and to keep our videos free for everyone. \n►► http://kgs.link/science\n(Worldwide Shipping Available)', 'Humans: Actually tries to resolve conflict\n\nAnts: *KILL*', '""War is a human invention""\nAnts when the other colony is a different color:😡', 'Back when they did amazing videos…', '""What is my purpose""\n""Block the hole with your head""\n""Oh my god""', '3:07 bro really emoted on them💀', 'In the grim darkness of the far future, there is only ant war', '“Home by the Queens birthday!”', 'I wonder if there’s a napoleon or the Gus khan of the ant world 😂', '“Some Ant groups just can’t get along” reminds me of current Hamas and Israel war, with tunnel colonies of Hamas as startling similarity to leaf cutter ants.']"
BSypUV6QUNw,"['You can now preorder the Kurzgesagt Immune System book! “IMMUNE –\xa0A Journey into the Mysterious System That Keeps You Alive”:\xa0https://kgs.link/ImmuneBook\nIMMUNE is a fascinating and fun journey through your own body, where we’ll be exploring mystery organs, murder universities, your enemies from viruses, bacteria and cancer (and how your immune system might have killed a cancer cell while you were reading the last few sentences) and the incredibly beautiful and amazing parts, cells and systems that keep you alive. After reading it you should not only gain a new appreciation for your own body but also experience disease differently. Also 45 illustrated pages by the Kurzgesagt team make the book very pretty.', 'Amazing 💜', 'And all this happened because of evolution...obviously their is an intelligent designer  behind all of this. God!!', 'Why oh why did you ask me to  imagine being covered in hornets!?🐝😖', 'Why is the title Serbian?', 'i’m seven years old', 'hey kurzgesagt can you please make complement toys that looks like theway in the video and they shuold work and act like lego can you publish it in the uk and usa besause i am in the uk and want you to make the coplement toys like lego in the uk so please make them', 'Great job 👍\nWhen studying immunology, the complement system drove me crazy 🤯😱😫😩', 'I really like this video and I love the immune system 😊🥰😍 Also because of this I really want to be a doctor ❤\n😊', 'Random question would complement help with cancer?']"
FfgT6zx4k3Q,"['Head over to our shop to get exclusive kurzgesagt merch and sciency products designed with love. \nGetting something from the kurzgesagt shop is the best way to support us and to keep our videos free for everyone. \n►► http://kgs.link/shopkgs\n(Worldwide Shipping Available)', 'my eyes burn when i stare at a screen for hours', 'Over long durations of time electronics cause entropy and atrophy of cellular structure, Mainly due to electrical dispersion which is the electricity moving through A open metal circuit that destabilize cellular structure. Also Higher electromagnetic frequencies wifi AKA electrons vibrating metals ""Frequency of wifi and cellular towers also cause cellular damage. on .gov they also say do not carry cell phones around on so they do not cause health problems.', ""I really appreciate that you stick to the evidences instead of being more vague about this topic because it'd be more catchy"", 'どこの国もマスメディアに苦労させられてるんだなあ...', 'Not a single BCS reference in these comments smh', '6:09 Is it me ? or Everyone thinks the *prolonged exposure* of even non ionizing radiation can *exhaust/burn/inflammation* to us?', 'So Godzilla has radiation in him... does he use a phone???', 'I know he swapped those numbers!', 'Przegląd kursów']"
ouAccsTzlGU,"['Head over to our shop to get exclusive kurzgesagt merch and sciency products designed with love. \nGetting something from the kurzgesagt shop is the best way to support us and to keep our videos free for everyone. \n►► http://kgs.link/shopkgs\n(Worldwide Shipping Available)', 'I’m vegetarian', ""So, what's the short answer of why is meat unhealthy?"", 'i love meat, and i like my steak as bloody as possible, i know the costs and i know the risks, i just dont give a damn!', 'Make a video on : does eating meat makes you dumb?', 'Great video!!!', 'Me eating 1kg a day', 'Lies. God created animals to be eaten by man', '2:08 then explain why popeye gets so strong.', 'Animals are food. Plants are drugs.']"
h4Uu5eyN6VU,"['Head over to our shop to get exclusive kurzgesagt merch and sciency products designed with love. \nGetting something from the kurzgesagt shop is the best way to support us and to keep our videos free for everyone. \n►► http://kgs.link/shopkgs\n(Worldwide Shipping Available)', 'EU is not as democratic as the single countries are, it’s pointed at the “veto option” when it’s pointed out that the EU lack democracy, as in theory each country can veto decisions. In reality the veto option is hard to actually use, as all the other countries will put enormous pressure on the country that in the end decide to use the right to veto. As we have seen now when Hungary vetoed the plan to give Ukraine even more economic support. Also EU have reduced the right to veto and will for sure reduce it even more making it almost impossible to use. There are many problems with democracy in EU, or the lack of democracy. For example there are no EU parties people can vote for, and no parties in the EU Parliament that actually announce their politics, it’s all very muddled, for a reason, as the whole point of the EU political process is stopping voters from actually have an impact in decision making. For example in the UK if people does not like the direction politics is taking they can vote out the government in the next election, this is absolutely impossible in EU, as who would you vote for??', '2:04 I love how the UK just flies off', 'More direct democracy is required and the EU Parlement must get full power over anything decided by the EU.', 'EU is trash because if a country joins it they will lose sovereignty', 'clay fighter pog', 'Anybody remember that migrant crisis in Europe some years ago?', ""I absolutly love Kurzgesagt, but i can't call a parliament influencial if he can't propose laws"", 'Why was Finland included in the map? Finland only became a meber this year?', 'No migrants and it would be perfect']"
zBkVCpbNnkU,"['You want to learn more about science? Check out our sciency products on the kurzgesagt shop – all designed with love and produced with care. \nGetting something from the kurzgesagt shop is the best way to support us and to keep our videos free for everyone. \n►► http://kgs.link/science\n(Worldwide Shipping Available)', '2 years later and the newer comments are just as hilariously volatile as before and with at least a few of the exact same faces, its quite hilarious how dedicated some people are to doing something so useless like spam anti-vaxx bullshit on a YouTube video when they could probably put that effort into doing something productive but instead they get hyper focused on the wrong things', 'If you disrespect the Head of the Table then you shouldn’t have a place at MY table. \rActions have consequences and I will make you understand\r\n👑\r\n🦁', ""I'm allergic to penicilin"", 'The only thing I wish this would mention is maybe something about how little females are used in health studies. Some vaccines can have some side effects on females that it would not have on males. Although that is a thing though I am so for vaccines and get all vaccines I am recommended, and especially for the reason of herd immunity.', 'Not so new News flash, we have longer life expectancies since the creation of vaccines. Case closed.', 'well this didnt age well', 'Well at least someone addressed this.', 'strangely prescient video topic for 2019 lmao', ""When you contract COVID, it can make you severely ill. At that point, your body is encountering an unknown virus, and it works to fight against the COVID infection. So, while there may be risks associated with the vaccine, there's also a significant risk of severe COVID infection because your body isn't familiar with what's happening. COVID can seriously impact your body's health.""]"
p_8yK2kmxoo,"['You want to learn more about space? Check out our space products on the kurzgesagt shop – all designed with love and produced with care. \nGetting something from the kurzgesagt shop is the best way to support us and to keep our videos free for everyone.  \n►► http://kgs.link/space\n(Worldwide Shipping Available)', 'Good one😂', 'Awful lot of the use of ""may"" and ""might"" and ""could"" here...', ""Why didn't they take the opportunity to call strange quarks a combination of queer and quark, queerks..."", 'Seems like inside these things exists around where pronouns are irrelevant and gender is useless. In a less cringy way than it is currently', 'Incel quarks —> neutrinos', 'Is it just me or does a lot of “science words” and “science names” sound really really dorky??\n\nLike, “Strange Matter” is so basic it could be a plot line in a sci-fi novel \n\nAnd then we have the names that are just random numbers and letters', 'Negative video', 'Bs video', 'Its god , why create like they are demon ,, because i guess thats how you look at world']"
JyECrGp-Sw8,"['Head over to our shop to get exclusive kurzgesagt merch and sciency products designed with love. \nGetting something from the kurzgesagt shop is the best way to support us and to keep our videos free for everyone. \n►► http://kgs.link/shopkgs\n(Worldwide Shipping Available)', '1:07 Earth exploded😂', '“You’re still going to school right?”', '4:46', 'Boom', 'You stopped me from doing this, thanks for the vid you saved earth!', 'Achei o meme!', 'Türkler', 'Are you a boy', 'Can it beat Goku though?']"
